<?xml version="1.0" encoding="UTF-8"?>
<tns:globalsuperheroes xmlns:tns="http://www.example.org/SuperheroSchema" xmlns:xsi="http://www.w3.org/2001/XMLSchema-instance" xsi:schemaLocation="http://www.example.org/SuperheroSchema SuperheroSchema.xsd ">
  <tns:superhero sid="idvalue0">
    <tns:name>tns:name</tns:name>
    <tns:specialPower>tns:specialPower</tns:specialPower>
  </tns:superhero>
  <tns:superhero sid="idvalue10">
    <tns:name>tns:name</tns:name>
    <tns:specialPower>tns:specialPower</tns:specialPower>
  </tns:superhero>
  <tns:superhero sid="idvalue2">
    <tns:name>tns:name</tns:name>
    <tns:specialPower>tns:specialPower</tns:specialPower>
  </tns:superhero>
  
  
</tns:globalsuperheroes>
